{
  "schema_version": "1.0.0",
  "id": "brownfield-proxy-mini",
  "mode": "brownfield",
  "title": "Brownfield: config rule warnings in the real proxy-for-ubuntu",
  "tags": ["brownfield", "rust", "real-product", "config"],
  "max_steps": 240,
  "max_cycles": 30,
  "thresholds": {"steps_growth": 0, "events_fall": 0, "tokens_growth": 0.1, "usd_growth": 0.1}
}
