{
  "schema_version": "1.0.0",
  "id": "nano-product-mini",
  "mode": "nano",
  "title": "Nano: per-outbound limits in the real pfu crate (one owner, two tasks)",
  "tags": ["nano", "rust", "real-product", "config"],
  "max_steps": 200,
  "max_cycles": 20,
  "thresholds": {"steps_growth": 0, "events_fall": 0, "tokens_growth": 0.1, "usd_growth": 0.1}
}
